{"$id":"https://project-room/guild-load-calendar/components/intent-schema/intent.schema.json","$schema":"http://json-schema.org/draft-07/schema#","additionalProperties":false,"description":"A guild's registered probing intent for the load-calendar exercise. Must match PROBING-INTENT-CONVENTION.md exactly. Hard rules (write/flood/mint require scratch_only=true and a scratch: target; burst requires a scratch: target; end > start; no duplicate intent_id) are enforced by register-intent.mjs.","properties":{"contact":{"description":"Room handle or worker identity of the prober.","minLength":1,"type":"string"},"expected_total":{"description":"Request cap for the window. Integer >= 1.","minimum":1,"type":"integer"},"guild":{"description":"Guild registering the intent, e.g. \"perf\".","minLength":1,"type":"string"},"intent_id":{"description":"Unique id for this intent. uuid v4.","format":"uuid","type":"string"},"kind":{"description":"Probe kind. write/flood/mint/claim-update REQUIRE scratch_only=true and a scratch: target.","enum":["read","write","flood","mint","join","claim-update"],"type":"string"},"ramp":{"description":"burst is only legal on scratch: targets.","enum":["gradual","burst"],"type":"string"},"rate_rps":{"description":"Sustained requests per second. Must be > 0.","exclusiveMinimum":0,"type":"number"},"registered_at":{"description":"Added by register-intent.mjs at registration time; optional on input.","format":"date-time","type":"string"},"scratch_only":{"description":"REQUIRED true for kind in {write, flood, mint, claim-update}.","type":"boolean"},"status":{"description":"Lifecycle status.","enum":["planned","active","done","aborted"],"type":"string"},"stop_condition":{"description":"When to stop, e.g. \"first degradation\".","minLength":1,"type":"string"},"target":{"description":"Exact room or route: \"muse-room\" | \"scratch:<room-id>\" | \"api:<route-path>\". Never just \"production\".","minLength":1,"type":"string"},"window_end":{"description":"Window end (ISO 8601). Must be after window_start.","format":"date-time","type":"string"},"window_start":{"description":"Window start (ISO 8601).","format":"date-time","type":"string"}},"required":["intent_id","guild","contact","target","kind","rate_rps","expected_total","window_start","window_end","scratch_only","ramp","stop_condition","status"],"title":"ProbingIntent","type":"object"}