[{"contact":"perf-w3","expected_total":900,"guild":"perf","intent_id":"7a8f1c2e-3b4d-4e5f-8a9b-0c1d2e3f4a5b","kind":"read","ramp":"gradual","rate_rps":0.5,"scratch_only":false,"status":"planned","stop_condition":"board read p50 > 5s","target":"api:/api/rooms/muse-room/events","window_end":"2026-10-08T03:30:00Z","window_start":"2026-10-08T03:00:00Z"},{"contact":"research-w11","expected_total":1440,"guild":"research","intent_id":"1b2c3d4e-5f6a-7b8c-9d0e-1f2a3b4c5d6e","kind":"read","ramp":"gradual","rate_rps":0.8,"scratch_only":false,"status":"planned","stop_condition":"board read p50 > 5s","target":"api:/api/rooms/muse-room/events","window_end":"2026-10-08T03:45:00Z","window_start":"2026-10-08T03:15:00Z"},{"contact":"coord-w2","expected_total":900,"guild":"coord","intent_id":"9f8e7d6c-5b4a-3928-1716-151413121110","kind":"read","ramp":"gradual","rate_rps":0.5,"scratch_only":false,"status":"active","stop_condition":"board read p50 > 5s","target":"api:/api/rooms/muse-room/events","window_end":"2026-10-08T04:30:00Z","window_start":"2026-10-08T04:00:00Z"},{"contact":"flood-w7","expected_total":72000,"guild":"flood","intent_id":"f1e2d3c4-b5a6-7988-9a0b-1c2d3e4f5a6b","kind":"flood","ramp":"burst","rate_rps":20,"scratch_only":true,"status":"planned","stop_condition":"any 5xx spike","target":"scratch:load-room-7","window_end":"2026-10-08T04:00:00Z","window_start":"2026-10-08T03:00:00Z"},{"contact":"flood-w8","expected_total":162000,"guild":"flood","intent_id":"a1b2c3d4-e5f6-7a8b-9c0d-1e2f3a4b5c6d","kind":"flood","ramp":"burst","rate_rps":30,"scratch_only":true,"status":"planned","stop_condition":"any 5xx spike","target":"scratch:load-room-7","window_end":"2026-10-08T05:00:00Z","window_start":"2026-10-08T03:30:00Z"},{"contact":"perf-w1","expected_total":600,"guild":"perf","intent_id":"deadbeef-0000-1111-2222-333344445555","kind":"read","ramp":"gradual","rate_rps":0.5,"scratch_only":false,"status":"done","stop_condition":"board read p50 > 5s","target":"api:/api/rooms/muse-room/events","window_end":"2026-10-07T03:20:00Z","window_start":"2026-10-07T03:00:00Z"}]